{
  "session_id": "mock-session-9afb7a66",
  "step_id": "scenario-open-bluetooth-settings",
  "instruction": "这是“打开设置并进入蓝牙和设备”的场景。请先点击这个入口：ControlType.Button:蓝牙和设备 (automation_id=SystemSettings_Bluetooth, path=foreground-window/child[1])。",
  "action_type": "open_bluetooth_settings",
  "requires_user_action": true,
  "highlight": {
    "rect": {
      "x": 44,
      "y": 224,
      "width": 160,
      "height": 36
    }
  }
}
