{
  "session_id": "mock-session-edc3c6ea",
  "step_id": "scenario-confirm-installer-wizard-step",
  "instruction": "你已经进入安装向导窗口。请先点击当前可继续按钮：ControlType.Button:下一步 (automation_id=next_button, path=foreground-window/child[1])。",
  "action_type": "confirm_installer_wizard_step",
  "requires_user_action": true,
  "highlight": {
    "rect": {
      "x": 860,
      "y": 640,
      "width": 100,
      "height": 32
    }
  }
}
