{
  "session_id": "mock-session-7f1eda36",
  "step_id": "scenario-recover-display-navigation",
  "instruction": "上一步进入“显示”页面没有成功。请先确认仍在设置窗口导航区域，然后重新点击这个入口：ControlType.Button:显示 (automation_id=SystemSettings_Display, path=foreground-window/child[0]/child[1])。",
  "action_type": "recover_display_navigation",
  "requires_user_action": true,
  "highlight": {
    "rect": {
      "x": 74,
      "y": 228,
      "width": 110,
      "height": 32
    }
  }
}
